{
  "$schema": "../../../contracts/audit-manifest.schema.json",
  "manifestVersion": "1.0.0",
  "bundleName": "unknown-heavy",
  "site": "https://unknowns.example.com",
  "generatedAt": "2026-04-10T05:00:00Z",
  "contract": {
    "auditReport": "1.0.0"
  },
  "artifacts": {
    "auditReportJson": "report.json"
  },
  "notes": [
    "Bundle with sparse evidence so the report has to surface uncertainty explicitly."
  ]
}
