{
  "$schema": "../../../contracts/audit-manifest.schema.json",
  "manifestVersion": "1.0.0",
  "bundleName": "clean-low-issue",
  "site": "https://healthy.example.com",
  "generatedAt": "2026-04-10T00:00:00Z",
  "contract": {
    "auditReport": "1.0.0"
  },
  "artifacts": {
    "auditReportJson": "report.json"
  },
  "notes": [
    "Mostly healthy bundle with only optional follow-up signals."
  ]
}
