{
  "$schema": "../../../contracts/audit-manifest.schema.json",
  "manifestVersion": "1.0.0",
  "bundleName": "json-only",
  "site": "https://json-only.example.com",
  "generatedAt": "2026-04-10T01:00:00Z",
  "contract": {
    "auditReport": "1.0.0"
  },
  "artifacts": {
    "auditReportJson": "report.json"
  },
  "notes": [
    "JSON-only bundle for clients that ingest structured artifacts without markdown siblings."
  ]
}
